{
  "schema_version": "3.3.0",
  "captured_at": "2026-04-28T09:14:35Z",
  "proposal": {
    "schema_version": "3.3.0",
    "proposal_id": "prop_2026-04-28_b3f1a2c4",
    "call_id": "call_2026-04-28_7e19c5ad",
    "agent": {
      "identity": "agent.support-triage.prod",
      "name": "support-triage-agent",
      "version": "1.4.2",
      "model": "claude-opus-4-7",
      "run_id": "run_2026-04-28_5f9e2c00"
    },
    "delegation_chain": [
      {
        "agent": {
          "identity": "agent.support-triage.prod",
          "name": "support-triage-agent",
          "version": "1.4.2",
          "model": "claude-opus-4-7",
          "run_id": "run_2026-04-28_5f9e2c00"
        },
        "call_id": "call_2026-04-28_7e19c5ad",
        "delegated_at": "2026-04-28T09:14:23Z"
      }
    ],
    "action_type": "email.send",
    "payload_schema": {
      "id": "https://raw.githubusercontent.com/renezander030/agent-approval-gate/v3.3.0/schemas/actions/email.send.schema.json",
      "version": "3.3.0",
      "digest": "sha256:67c27141c6f596b128b8f3ac444f3e9b05813c1cc89a509a3df2fd3b78fb86bc"
    },
    "payload": {
      "from": "support@acme-corp.example",
      "to": [
        "customer@example.com"
      ],
      "cc": [],
      "subject": "Re: cannot export invoices for March",
      "body_text": "Hi,\n\nThanks for the report. The export endpoint was rate-limited above the documented threshold last week — we've raised it back to 50 req/min. Please retry the March export and let us know if it still fails.\n\nIf you need the data sooner, I can run the export on our side and email you the CSV directly.\n\nBest,\nSupport",
      "in_reply_to_message_id": "<CADx7HnZ@example.com>",
      "ticket_id": "ZD-48211"
    },
    "rationale": "The export issue maps to the documented rate-limit incident. Confirm the fix and offer a manual export as fallback.",
    "created_at": "2026-04-28T09:14:23Z",
    "expires_at": "2026-04-28T17:14:23Z",
    "tenant": "acme-corp",
    "risk": "medium",
    "effects": {
      "read_only": false,
      "destructive": false,
      "idempotent": true,
      "open_world": true
    },
    "idempotency_key": "idem_email_ZD-48211_reply_01"
  },
  "validations": [
    {
      "schema_version": "3.3.0",
      "validation_id": "validation_2026-04-28_841ac000",
      "proposal_id": "prop_2026-04-28_b3f1a2c4",
      "action_hash": "sha256:d1f381a334348c7fa708c71672fac0a12aed8e1523a4fb5cae8ac010119a2f6f",
      "validator": {
        "kind": "system",
        "identifier": "approval-validator",
        "authentication": {
          "method": "service_identity",
          "human_present": false,
          "assurance": "high",
          "authenticated_at": "2026-04-28T09:14:24Z"
        }
      },
      "validated_at": "2026-04-28T09:14:24Z",
      "outcome": "passed",
      "checks": [
        {
          "name": "proposal_schema",
          "status": "passed"
        },
        {
          "name": "payload_schema",
          "status": "passed"
        },
        {
          "name": "semantic_preconditions",
          "status": "passed"
        },
        {
          "name": "policy_inputs",
          "status": "passed"
        },
        {
          "name": "authorization_inputs",
          "status": "passed"
        }
      ]
    }
  ],
  "review_snapshots": [
    {
      "schema_version": "3.3.0",
      "snapshot_id": "review_2026-04-28_47b2c000",
      "proposal_id": "prop_2026-04-28_b3f1a2c4",
      "action_hash": "sha256:d1f381a334348c7fa708c71672fac0a12aed8e1523a4fb5cae8ac010119a2f6f",
      "payload_hash": "sha256:c919182dcf3aa49d95f5927636aeb7a6a227fa9f9b3daa7384ac4c531a9f891b",
      "content_hash": "sha256:f083f7bfda27308336553a5d759f39a1c8279a162dc870471a0595a5942ebf70",
      "rendered_at": "2026-04-28T09:14:26Z",
      "renderer": {
        "name": "approval-email-renderer",
        "version": "3.0.0",
        "format": "json"
      },
      "locale": "en-US",
      "content": {
        "action_type": "email.send",
        "action_identity": {
          "proposal_id": "prop_2026-04-28_b3f1a2c4",
          "call_id": "call_2026-04-28_7e19c5ad",
          "agent_identity": "agent.support-triage.prod"
        },
        "target": {
          "from": "support@acme-corp.example",
          "to": [
            "customer@example.com"
          ],
          "cc": []
        },
        "arguments": {
          "from": "support@acme-corp.example",
          "to": [
            "customer@example.com"
          ],
          "cc": [],
          "subject": "Re: cannot export invoices for March",
          "body_text": "Hi,\n\nThanks for the report. The export endpoint was rate-limited above the documented threshold last week — we've raised it back to 50 req/min. Please retry the March export and let us know if it still fails.\n\nIf you need the data sooner, I can run the export on our side and email you the CSV directly.\n\nBest,\nSupport",
          "in_reply_to_message_id": "<CADx7HnZ@example.com>",
          "ticket_id": "ZD-48211"
        },
        "risk": "medium",
        "effects": {
          "read_only": false,
          "destructive": false,
          "idempotent": true,
          "open_world": true
        },
        "expires_at": "2026-04-28T17:14:23Z",
        "policy_summary": "One distinct customer-support approver; email decisions require a signature."
      }
    }
  ],
  "request": {
    "schema_version": "3.3.0",
    "request_id": "req_2026-04-28_6a2d8800",
    "proposal_id": "prop_2026-04-28_b3f1a2c4",
    "call_id": "call_2026-04-28_7e19c5ad",
    "tenant": "acme-corp",
    "action_hash": "sha256:d1f381a334348c7fa708c71672fac0a12aed8e1523a4fb5cae8ac010119a2f6f",
    "validation_id": "validation_2026-04-28_841ac000",
    "review_snapshot_id": "review_2026-04-28_47b2c000",
    "callback_nonce_hash": "sha256:91eaf28be1fa8121d74d9ce65298da05363c70dfb691c4c4e1a17691bb09966a",
    "requested_at": "2026-04-28T09:14:25Z",
    "expires_at": "2026-04-28T17:14:23Z",
    "status": "consumed",
    "revision": 3,
    "requested_by": {
      "kind": "system",
      "identifier": "approval-router",
      "authentication": {
        "method": "service_identity",
        "human_present": false,
        "assurance": "high",
        "authenticated_at": "2026-04-28T09:14:25Z"
      }
    },
    "policy": {
      "schema_version": "3.3.0",
      "policy_id": "policy.high-risk-email.v1",
      "revision": "2026-04-15.3",
      "policy_digest": "sha256:a4f5ac837738a43e70baa0f2d602bbba2f2285a518beb568746f310f0678dc35",
      "evaluation_id": "eval_2026-04-28_1c4f8a00",
      "material_input_hash": "sha256:d1f381a334348c7fa708c71672fac0a12aed8e1523a4fb5cae8ac010119a2f6f",
      "evaluated_at": "2026-04-28T09:14:24Z",
      "outcome": "auto_approve",
      "requirements": {
        "minimum_approvals": 1,
        "distinct_approvers": true,
        "human_only": false,
        "allowed_channels": [
          "email",
          "web",
          "policy"
        ],
        "signature_required_channels": [
          "email"
        ],
        "allow_auto_approval": true,
        "human_required_effects": [
          "destructive"
        ],
        "separation_of_duties": {
          "requester_must_not_approve": true,
          "agent_must_not_approve": true,
          "distinct_signing_keys": true,
          "excluded_actor_ids": [
            "approval-router",
            "agent.support-triage.prod"
          ],
          "excluded_key_ids": [
            "agent-fleet-shared-key"
          ]
        },
        "require_standing_grant": true
      },
      "matched_rules": [
        {
          "rule_id": "rule.support.granted-reply",
          "effect": "auto_approve"
        }
      ]
    },
    "channels": [
      {
        "channel": "email",
        "target_hash": "sha256:e8e3f7b243a672993b9c238585042b95995665863cc28ff00adeafca8e5ecb1b",
        "delivery_status": "delivered",
        "notification_id": "mail_2026-04-28_3391",
        "sent_at": "2026-04-28T09:14:26Z"
      }
    ],
    "terminal_at": "2026-04-28T09:14:31Z",
    "decision_record_id": "approval_2026-04-28_f9821000",
    "consumed_at": "2026-04-28T09:14:33Z",
    "dispatch_id": "dispatch_2026-04-28_4ad31000",
    "terminal_reason": "consumed_for_dispatch"
  },
  "approvals": [
    {
      "schema_version": "3.3.0",
      "approval_id": "approval_2026-04-28_f9821000",
      "request_id": "req_2026-04-28_6a2d8800",
      "proposal_id": "prop_2026-04-28_b3f1a2c4",
      "request_revision": 1,
      "action_hash": "sha256:d1f381a334348c7fa708c71672fac0a12aed8e1523a4fb5cae8ac010119a2f6f",
      "payload_hash": "sha256:c919182dcf3aa49d95f5927636aeb7a6a227fa9f9b3daa7384ac4c531a9f891b",
      "review_snapshot_id": "review_2026-04-28_47b2c000",
      "review_content_hash": "sha256:f083f7bfda27308336553a5d759f39a1c8279a162dc870471a0595a5942ebf70",
      "decision": "auto_approved",
      "decided_by": {
        "kind": "policy",
        "identifier": "policy.high-risk-email.v1",
        "authentication": {
          "method": "policy_engine",
          "human_present": false,
          "assurance": "high",
          "authenticated_at": "2026-04-28T09:14:27Z"
        }
      },
      "decided_at": "2026-04-28T09:14:27Z",
      "recorded_at": "2026-04-28T09:14:27Z",
      "channel": "policy",
      "policy_evaluation_id": "eval_2026-04-28_1c4f8a00",
      "standing_grant": {
        "grant_id": "grant_2026-04-27_support-replies",
        "granted_by": {
          "kind": "human",
          "identifier": "rene@acme-corp.example",
          "display_name": "Rene Z.",
          "roles": [
            "customer-support"
          ],
          "authentication": {
            "method": "signed_callback",
            "human_present": true,
            "assurance": "substantial",
            "authenticated_at": "2026-04-28T09:14:30Z",
            "evidence_ref": "mail-callback:mail_2026-04-28_3391"
          }
        },